title,link,full_text,categories,date_time,source,author,authors_rate,authors_rate_score,likes_count,dislikes_count«Россия всегда рассчитывала только на себя»: ярославец о специальной военной операции на Украине,https://1yar.tv/article/rossiya-vsegda-rasschityvala-tolko-na-sebya-yaroslavec-o-specialnoy-voennoy-operacii-na-ukraine/,"Сегодня своим мнением с «Первым Ярославским» поделился генеральный директор Центра политического консультирования Андрей Становой.
Ярославец уверен, что Россия – великая держава – и у нее всегда найдутся единомышленники. Вот, как эксперт рассуждает о специальной военной операции на Украине:
Фото: Андрей Становой.",['Общество'],2022-03-26 10:01:55,Первый Ярославский,Елизавета Соловьёва,87.85,2790,1,0
"Жительница Ярославля, пережившая Майдан и подвергшаяся преследованиям, призывает народ противостоять коллективному Западу",https://1yar.tv/article/jitelnica-yaroslavlya-perejivshaya-maydan-i-podvergshayasya-presledovaniyam-prizyvaet-narod-protivostoyat-kollektivnomu-zapadu/,"Светлана Пикта подверглась преследованию украинских властей за то, что осмелилась отстаивать право получать образование на русском языке.
После этого она вынуждена была бежать в Россию и теперь живет в Ярославле.
Фото: Светлана Пикта.",['Общество'],2022-03-26 09:50:05,Первый Ярославский,Елизавета Соловьёва,87.85,2790,4,1
Зарплата 800 тысяч: куда поехать на заработки ярославцам,https://1yar.tv/article/zarplata-800-tysyach-kuda-poehat-na-zarabotki-yaroslavcam/,"В современных реалиях найти высокооплачиваемую работу довольно нелегко.
Ранее «Первый Ярославский» сообщал, что в Ярославской области есть вакантные должности с оплатой труда до 120 тысяч рублей в месяц.
Для тех, кому эта сумма кажется небольшой, есть вариант уехать на заработки вахтовым методом.
Работу вахтой чаще всего предлагают машинистам (14% вахтовых вакансий), водителям (11%), сварщикам (8%), фрезеровщикам и токарям (6%), а также слесарям (6%). В целом большая часть вахтовых вакансий относится к категориям специалистов по добыче сырья и производственного персонала. Однако представителям других специальностей тоже можно найти варианты – вахтовые предложения есть для поваров, охранников, нянь, программистов, врачей и даже для продавцов.
Рейтинг самых высокооплачиваемых вахтовых вакансий в сфере добычи сырья и производства возглавил начальник участка буровзрывных работ с вахтой в Норильске – специалисту предлагают зарплату до 800 тысяч рублей, а также комфортные условия проживания, трехразовое бесплатное питание и оплату проезда.
Чтобы претендовать на должность, необходимо высшее горное образование, стаж работы начальником участка БВР (ОГР) не менее пяти лет, а также наличие «Единой книжки взрывника» с правом руководства взрывными работами и аттестации Ростехнадзора.",['Общество'],2022-03-26 09:00:00,Первый Ярославский,Елизавета Соловьёва,87.85,2790,1,0
"В Центробанке рассказали, как ярославцам оплачивать покупки с помощью телефона",https://1yar.tv/article/v-centrobanke-rasskazali-kak-yaroslavcam-oplachivat-pokupki-s-pomoshchyu-telefona/,"От удобной привычки отказываться не стоит.
В последнее время у ярославцев перестали работать сервисы для безналичной оплате. Речь идет об Эпл Пэй и Гугл Пэй для карт Виза и Мастеркард.
Напомним, что международными картами можно воспользоваться при стандартной контактной или бесконтактной оплате в полном объеме на всей территории России.
Второй способ оплаты при помощи смартфона – по QR-коду через Систему быстрых платежей. QR-код - это графическое изображение, в котором зашифрованы реквизиты получателя, назначение платежа и его сумма. QR-код формируется на кассовом чеке, если торговая точка принимает оплату через СБП. Покупателю нужно просто сканировать QR-код через мобильное приложение банка, ввести или подтвердить сумму к оплате на экране. В тот же момент деньги за товары или услуги будут перечислены на счет продавца. При этом комиссия с граждан не взимается.
Используя этот вариант платежей можно произвести оплату не только по QR-коду на кассе в магазине, но и по QR-наклейке на платежках за услуги или же QR-коду для оплаты в интернете с экрана гаджета.
Для получения оперативных ответов на финансовые вопросы используйте бесплатное мобильное приложение «ЦБ онлайн», где можно найти информацию по самому широкому кругу тем, задать вопрос в чате или пообщаться с консультантом вживую.",['Общество'],2022-03-26 08:00:00,Первый Ярославский,Елизавета Соловьёва,87.85,2790,1,0
За год 2121 ярославец был пролечен от острого коронарного синдрома,https://1yar.tv/article/za-god-2121-yaroslavec-byl-prolechen-ot-ostrogo-koronarnogo-sindroma/,"Такие данные приводит Областная клиническая больница.
В Ярославской области активно реализуется программа «Борьба с сердечно-сосудистыми заболеваниями».
За 2021 год был пролечен 2121 пациент с острым коронарным синдромом, из них - 1813 пациентов с острым инфарктом миокарда.
Пациентам с острым коронарным синдромом и хронической ишемической болезнью сердца проведено 1641 стентирование коронарных артерий, выполнено 245 операций аортокоронарного шунтирования,124 операции РЧА при нарушении ритма сердца. Лечение пациентов проводится в соответствии с клиническими рекомендациями Минздрава России.
Фото: ГБУЗ ЯО «Областная клиническая больница»",['Общество'],2022-03-26 07:00:00,Первый Ярославский,Елизавета Соловьёва,87.85,2790,1,0
